id_Article,numero_loi,numero_decret,numero_article,multiplicatif,date_signature,division_partie,division_livre,division_titre,division_chapitre,division_section,division_paragraphe,contenu,code
424,65-60,,308,,1965-07-21,PARTIE I - DISPOSITIONS PRELIMINAIRES,"Livrera à une puissance étrangère ou à ses agents, soit des troupes séné- galaises, soit des territoires, villes, forteresses, ouvrages, postes, magasins, arsenaux, matériels, munitions, vais- seaux, bâtiments ou appareils de navigation aérienne appartenant au Sénégal ou affectés à sa défense;",TITRE DEUXIEME - CRIMES ET DELITS CONTRE LES PARTICULIERS,CHAPITRE PREMIER - CRIMES ET DELITS CONTRE LES PERSONNES,SECTION III - HOMICIDE ET BLESSURES INVOLONTAIRES,Paragraphe Il - Menaces,"Si	un	incendie involontairement provoqué entraîne la mort ou provoque les blessures d'une ou plusieurs personnes, il sera fait  application  des  peines prévues pour l'homicide ou les blessures par imprudence.",Pénal
425,65-60,,309,,1965-07-21,PARTIE I - DISPOSITIONS PRELIMINAIRES,"Livrera à une puissance étrangère ou à ses agents, soit des troupes séné- galaises, soit des territoires, villes, forteresses, ouvrages, postes, magasins, arsenaux, matériels, munitions, vais- seaux, bâtiments ou appareils de navigation aérienne appartenant au Sénégal ou affectés à sa défense;",TITRE DEUXIEME - CRIMES ET DELITS CONTRE LES PARTICULIERS,CHAPITRE PREMIER - CRIMES ET DELITS CONTRE LES PERSONNES,SECTION IV - DES INFRACTIONS EXCUSABLES ET DES CAS OU ELLES NE PEUVENT ETRE EXCUSEES,Paragraphe Il - Menaces,"Le meurtre ainsi que les blessures et les coups sont excusables, s'ils ont été provoqués par des coups ou violences graves envers les personnes.",Pénal
426,65-60,,310,,1965-07-21,PARTIE I - DISPOSITIONS PRELIMINAIRES,"Livrera à une puissance étrangère ou à ses agents, soit des troupes séné- galaises, soit des territoires, villes, forteresses, ouvrages, postes, magasins, arsenaux, matériels, munitions, vais- seaux, bâtiments ou appareils de navigation aérienne appartenant au Sénégal ou affectés à sa défense;",TITRE DEUXIEME - CRIMES ET DELITS CONTRE LES PARTICULIERS,CHAPITRE PREMIER - CRIMES ET DELITS CONTRE LES PERSONNES,SECTION IV - DES INFRACTIONS EXCUSABLES ET DES CAS OU ELLES NE PEUVENT ETRE EXCUSEES,Paragraphe Il - Menaces,"Les crimes et délits mentionnés au précèdent article sont également excusables, s'ils ont été commis en repoussant pendant l'escalade ou l'effraction des clôtures, murs ou entrée d'une maison ou d'un appartement habité ou de leurs dépendances.
Si le fait est arrivé pendant la nuit, ce cas est réglé par l'article 317.",Pénal
427,65-60,,311,,1965-07-21,PARTIE I - DISPOSITIONS PRELIMINAIRES,"Livrera à une puissance étrangère ou à ses agents, soit des troupes séné- galaises, soit des territoires, villes, forteresses, ouvrages, postes, magasins, arsenaux, matériels, munitions, vais- seaux, bâtiments ou appareils de navigation aérienne appartenant au Sénégal ou affectés à sa défense;",TITRE DEUXIEME - CRIMES ET DELITS CONTRE LES PARTICULIERS,CHAPITRE PREMIER - CRIMES ET DELITS CONTRE LES PERSONNES,SECTION IV - DES INFRACTIONS EXCUSABLES ET DES CAS OU ELLES NE PEUVENT ETRE EXCUSEES,Paragraphe Il - Menaces,Le parricide n'est jamais excusable.,Pénal
428,65-60,,312,,1965-07-21,PARTIE I - DISPOSITIONS PRELIMINAIRES,"Livrera à une puissance étrangère ou à ses agents, soit des troupes séné- galaises, soit des territoires, villes, forteresses, ouvrages, postes, magasins, arsenaux, matériels, munitions, vais- seaux, bâtiments ou appareils de navigation aérienne appartenant au Sénégal ou affectés à sa défense;",TITRE DEUXIEME - CRIMES ET DELITS CONTRE LES PARTICULIERS,CHAPITRE PREMIER - CRIMES ET DELITS CONTRE LES PERSONNES,SECTION IV - DES INFRACTIONS EXCUSABLES ET DES CAS OU ELLES NE PEUVENT ETRE EXCUSEES,Paragraphe Il - Menaces,"Le meurtre commis par l'époux sur l'épouse, ou par celle-ci sur son époux, n'est pas excusable, si la vie de l'époux ou de l'épouse qui a commis le meurtre n'a pas été mise en péril dans le moment même où le meurtre a eu lieu.
Néanmoins dans le cas d'adultère, prévu par l'article 330, le meurtre commis par l'un des conjoints sur l'autre, ainsi que sur le complice, à l'instant où il les surprend en flagrant délit, est excusable.",Pénal
429,65-60,,313,,1965-07-21,PARTIE I - DISPOSITIONS PRELIMINAIRES,"Livrera à une puissance étrangère ou à ses agents, soit des troupes séné- galaises, soit des territoires, villes, forteresses, ouvrages, postes, magasins, arsenaux, matériels, munitions, vais- seaux, bâtiments ou appareils de navigation aérienne appartenant au Sénégal ou affectés à sa défense;",TITRE DEUXIEME - CRIMES ET DELITS CONTRE LES PARTICULIERS,CHAPITRE PREMIER - CRIMES ET DELITS CONTRE LES PERSONNES,SECTION IV - DES INFRACTIONS EXCUSABLES ET DES CAS OU ELLES NE PEUVENT ETRE EXCUSEES,Paragraphe Il - Menaces,"Le crime de castration, s'il a été immédiatement provoqué par un outrage violent à la pudeur, sera considéré comme meurtre ou blessures excusables.",Pénal
430,65-60,,314,,1965-07-21,PARTIE I - DISPOSITIONS PRELIMINAIRES,"Livrera à une puissance étrangère ou à ses agents, soit des troupes séné- galaises, soit des territoires, villes, forteresses, ouvrages, postes, magasins, arsenaux, matériels, munitions, vais- seaux, bâtiments ou appareils de navigation aérienne appartenant au Sénégal ou affectés à sa défense;",TITRE DEUXIEME - CRIMES ET DELITS CONTRE LES PARTICULIERS,CHAPITRE PREMIER - CRIMES ET DELITS CONTRE LES PERSONNES,SECTION IV - DES INFRACTIONS EXCUSABLES ET DES CAS OU ELLES NE PEUVENT ETRE EXCUSEES,Paragraphe Il - Menaces,"Lorsque le fait d'excuse sera prouvé:
S'il s'agit d'un crime emportant la peine de mort ou celle des travaux forcés à perpétuité, la peine sera réduite à un emprisonnement de deux ans à dix ans;
S'il s'agit de tout autre crime, elle sera réduite à un emprisonnement de deux à cinq ans.
Dans ces deux premiers cas, les coupables pourront de plus être interdits de séjour par l'arrêt ou le jugement pendant une durée de cinq à dix ans.
S'il s'agit d'un délit, la peine sera réduite à un emprisonnement d'un mois à un an.",Pénal
431,65-60,,315,,1965-07-21,PARTIE I - DISPOSITIONS PRELIMINAIRES,"Livrera à une puissance étrangère ou à ses agents, soit des troupes séné- galaises, soit des territoires, villes, forteresses, ouvrages, postes, magasins, arsenaux, matériels, munitions, vais- seaux, bâtiments ou appareils de navigation aérienne appartenant au Sénégal ou affectés à sa défense;",TITRE DEUXIEME - CRIMES ET DELITS CONTRE LES PARTICULIERS,CHAPITRE PREMIER - CRIMES ET DELITS CONTRE LES PERSONNES,SECTION IV - DES INFRACTIONS EXCUSABLES ET DES CAS OU ELLES NE PEUVENT ETRE EXCUSEES,Paragraphe Il - Menaces,"Il n'y a ni crime ni délit, lorsque l'homicide les blessures et les coups étaient ordonnés par la loi et commandés par l'autorité légitime.",Pénal
432,65-60,,316,,1965-07-21,PARTIE I - DISPOSITIONS PRELIMINAIRES,"Livrera à une puissance étrangère ou à ses agents, soit des troupes séné- galaises, soit des territoires, villes, forteresses, ouvrages, postes, magasins, arsenaux, matériels, munitions, vais- seaux, bâtiments ou appareils de navigation aérienne appartenant au Sénégal ou affectés à sa défense;",TITRE DEUXIEME - CRIMES ET DELITS CONTRE LES PARTICULIERS,CHAPITRE PREMIER - CRIMES ET DELITS CONTRE LES PERSONNES,SECTION IV - DES INFRACTIONS EXCUSABLES ET DES CAS OU ELLES NE PEUVENT ETRE EXCUSEES,Paragraphe Il - Menaces,"Il n'y a ni crime ni délit, lorsque l'homicide, les blessures et les coups étaient commandés par la nécessité actuelle de la légitime défense de soi-même ou d'autrui.",Pénal
433,65-60,,317,,1965-07-21,PARTIE I - DISPOSITIONS PRELIMINAIRES,"Livrera à une puissance étrangère ou à ses agents, soit des troupes séné- galaises, soit des territoires, villes, forteresses, ouvrages, postes, magasins, arsenaux, matériels, munitions, vais- seaux, bâtiments ou appareils de navigation aérienne appartenant au Sénégal ou affectés à sa défense;",TITRE DEUXIEME - CRIMES ET DELITS CONTRE LES PARTICULIERS,CHAPITRE PREMIER - CRIMES ET DELITS CONTRE LES PERSONNES,SECTION IV - DES INFRACTIONS EXCUSABLES ET DES CAS OU ELLES NE PEUVENT ETRE EXCUSEES,Paragraphe Il - Menaces,"Sont compris dans les cas de nécessité actuelle de défense, les deux cas suivants:
1° Si l'homicide a été commis, si les blessures ont été faites, ou si les coups ont été portés en repoussant, pendant la nuit, l'escalade ou l'effraction des clôtures, murs ou entrée d'une maison ou d'un appartement habité ou de leurs dépendances;
2° Si le fait a eu lieu en se défendant contre les auteurs de vois ou de pillages exécutés avec violence.",Pénal
434,65-60,,318,,1965-07-21,PARTIE I - DISPOSITIONS PRELIMINAIRES,"Livrera à une puissance étrangère ou à ses agents, soit des troupes séné- galaises, soit des territoires, villes, forteresses, ouvrages, postes, magasins, arsenaux, matériels, munitions, vais- seaux, bâtiments ou appareils de navigation aérienne appartenant au Sénégal ou affectés à sa défense;",TITRE DEUXIEME - CRIMES ET DELITS CONTRE LES PARTICULIERS,CHAPITRE PREMIER - CRIMES ET DELITS CONTRE LES PERSONNES,SECTION V - ATTENTATS AUX MOEURS,Paragraphe Il - Menaces,Toute personne qui aura commis un outrage public à la pudeur sera punie d'un emprisonnement de trois mois à deux ans et d'une amende de 20.000 à 200.000 francs.,Pénal
435,65-60,,319,,1965-07-21,PARTIE I - DISPOSITIONS PRELIMINAIRES,"Livrera à une puissance étrangère ou à ses agents, soit des troupes séné- galaises, soit des territoires, villes, forteresses, ouvrages, postes, magasins, arsenaux, matériels, munitions, vais- seaux, bâtiments ou appareils de navigation aérienne appartenant au Sénégal ou affectés à sa défense;",TITRE DEUXIEME - CRIMES ET DELITS CONTRE LES PARTICULIERS,CHAPITRE PREMIER - CRIMES ET DELITS CONTRE LES PERSONNES,SECTION V - ATTENTATS AUX MOEURS,Paragraphe Il - Menaces,"(Loi n°66-16 du 1er février 1966)
Tout attentat à la pudeur consommé ou tenté sans violence sur la personne d'un enfant de l'un ou de l'autre sexe âgé de moins de treize ans, sera puni d'un emprisonnement de deux à cinq ans.
Sera puni du maximum de la peine, l'attentat à la pudeur commis partout ascendant ou toute personne ayant autorité sur la victime mineure, même âgée de plus de treize ans.
Sans préjudice des peines plus graves prévues par les alinéas qui précédent ou par les articles 320 et 321 du présent Code, sera puni d'un emprisonnement d'un à cinq ans  et  d'une  amende  de
100.000 à 1.500.000 francs,
quiconque aura commis un acte impudique ou contre nature avec un individu de son sexe. Si l'acte a été commis avec un mineur de
21 ans, le maximum de la peine sera toujours prononcé.",Pénal
436,99-05,,319,bis,1999-01-29,PARTIE I - DISPOSITIONS PRELIMINAIRES,"Livrera à une puissance étrangère ou à ses agents, soit des troupes séné- galaises, soit des territoires, villes, forteresses, ouvrages, postes, magasins, arsenaux, matériels, munitions, vais- seaux, bâtiments ou appareils de navigation aérienne appartenant au Sénégal ou affectés à sa défense;",TITRE DEUXIEME - CRIMES ET DELITS CONTRE LES PARTICULIERS,CHAPITRE PREMIER - CRIMES ET DELITS CONTRE LES PERSONNES,SECTION V - ATTENTATS AUX MOEURS,Paragraphe Il - Menaces,"(loi n°99-05 du 29 janvier 1999)
Le fait de harceler autrui en usant d'ordres, de gestes, de menaces, de paroles, d'écrits ou de contraintes dans le but d'obtenir des faveurs de nature sexuelle, par une personne abusant de l'autorité que lui confèrent ses fonctions sera puni d'un emprisonnement de six mois à trois ans et d'une amende de 50.000 à 500.000 francs.
Lorsque la victime de l'infraction est âgée de moins de 16 ans, le maximum de la peine d'emprisonnement sera prononcée.",Pénal
437,99-05,,320,,1999-01-29,PARTIE I - DISPOSITIONS PRELIMINAIRES,"Livrera à une puissance étrangère ou à ses agents, soit des troupes séné- galaises, soit des territoires, villes, forteresses, ouvrages, postes, magasins, arsenaux, matériels, munitions, vais- seaux, bâtiments ou appareils de navigation aérienne appartenant au Sénégal ou affectés à sa défense;",TITRE DEUXIEME - CRIMES ET DELITS CONTRE LES PARTICULIERS,CHAPITRE PREMIER - CRIMES ET DELITS CONTRE LES PERSONNES,SECTION V - ATTENTATS AUX MOEURS,Paragraphe Il - Menaces,"(loi n°99-05 du 29 janvier 1999)
Tout acte de pénétration sexuelle, de quelque nature qu'il soit, commis sur la personne d'autrui par violence, contrainte, menace ou surprise est un viol.
Le viol sera puni d'un emprisonnement de cinq à dix ans.
S'il a entraîné une mutilation, une infirmité permanente ou si l'infraction a été	commise	par séquestration ou par plusieurs personnes, la peine ci-dessus sera doublée.
S'il a entraîné la mort, les auteurs seront punis comme coupable d'assassinat.
Si l'infraction a été commise sur un enfant au dessous de 13 ans accomplis ou	une	personne particulièrement vulnérable en raison de son état de grossesse, de son âge avancé ou de son état de santé ayant entraîné une déficience physique ou psychique, le coupable subira le maximum de la peine.
Quiconque aura commis ou tenté de commettre un attentat à la pudeur, consommé ou tenté avec violence, contre des individus de l'un ou l'autre sexe sera puni	d'une	peine d'emprisonnement de cinq à dix ans.
Si le délit a été commis sur la personne d'un enfant au-dessous de l'âge de 13 ans accomplis ou d'une personne particulièrement vulnérable en raison de son état de grossesse, de son âge avancé ou de son état de santé ayant entraîné une déficience physique ou psychique, le coupable subira le maximum de la peine.",Pénal
438,99-05,,320,bis,1999-01-29,PARTIE I - DISPOSITIONS PRELIMINAIRES,"Livrera à une puissance étrangère ou à ses agents, soit des troupes séné- galaises, soit des territoires, villes, forteresses, ouvrages, postes, magasins, arsenaux, matériels, munitions, vais- seaux, bâtiments ou appareils de navigation aérienne appartenant au Sénégal ou affectés à sa défense;",TITRE DEUXIEME - CRIMES ET DELITS CONTRE LES PARTICULIERS,CHAPITRE PREMIER - CRIMES ET DELITS CONTRE LES PERSONNES,SECTION V - ATTENTATS AUX MOEURS,Paragraphe Il - Menaces,"(loi n°99-05 du 29 janvier 1999)
Tout geste, attouchement, caresse,	manipulation pornographique, utilisation d'images ou de sons par un procédé		technique quelconque, à des fins sexuelles sur un enfant de moins de seize ans de l'un ou l'autre sexe constitue l'acte pédophile puni d'un emprisonnement de cinq à dix ans.
Si le délit a été commis par  un  ascendant  ou  une personne ayant autorité surle mineur, le maximum de la peine sera toujours prononcé.
La tentative est punie comme délit consommé.",Pénal
439,99-05,,320,ter,1999-01-29,PARTIE I - DISPOSITIONS PRELIMINAIRES,"Livrera à une puissance étrangère ou à ses agents, soit des troupes séné- galaises, soit des territoires, villes, forteresses, ouvrages, postes, magasins, arsenaux, matériels, munitions, vais- seaux, bâtiments ou appareils de navigation aérienne appartenant au Sénégal ou affectés à sa défense;",TITRE DEUXIEME - CRIMES ET DELITS CONTRE LES PARTICULIERS,CHAPITRE PREMIER - CRIMES ET DELITS CONTRE LES PERSONNES,SECTION V - ATTENTATS AUX MOEURS,Paragraphe Il - Menaces,"(Loi n°99-05 du 29 janvier 1999)
Le fait de favoriser la corruption d'un mineur est puni d'un emprisonnement de un à cinq ans et d'une amende  de  100.000  à
1.500.000 francs. Les peines encourues sont de trois à sept ans d'emprisonnement et de 200.000 à 3.000.000 francs d'amende lorsque le mineur est âgé de moins de treize ans accomplis.
Les mêmes peines sont notamment applicables au fait, commis par un majeur, d'organiser des réunions comportant des exhibitions ou des relations sexuelles auxquelles un mineur assiste ou participe.",Pénal
440,65-60,,321,,1965-07-21,PARTIE I - DISPOSITIONS PRELIMINAIRES,"Livrera à une puissance étrangère ou à ses agents, soit des troupes séné- galaises, soit des territoires, villes, forteresses, ouvrages, postes, magasins, arsenaux, matériels, munitions, vais- seaux, bâtiments ou appareils de navigation aérienne appartenant au Sénégal ou affectés à sa défense;",TITRE DEUXIEME - CRIMES ET DELITS CONTRE LES PARTICULIERS,CHAPITRE PREMIER - CRIMES ET DELITS CONTRE LES PERSONNES,SECTION V - ATTENTATS AUX MOEURS,Paragraphe Il - Menaces,"Si les coupables sont les ascendants de la personne sur laquelle a été commis l'attentat, s'ils sont de ceux qui ont autorité sur elle, s'ils sont de ceux qui sont chargés de son éducation ou ses serviteurs à gages, ou serviteurs à gages des personnes ci-dessus dési-gnées, s'ils sont fonction-naires ou ministres d'un culte, ou si le coupable, quel qu'il soit, a été aidé dans son délit par une ou plusieurs personnes, la peine sera celle d'un emprisonnement de dix ans.",Pénal
441,99-05,,322,,1999-01-29,PARTIE I - DISPOSITIONS PRELIMINAIRES,"Livrera à une puissance étrangère ou à ses agents, soit des troupes séné- galaises, soit des territoires, villes, forteresses, ouvrages, postes, magasins, arsenaux, matériels, munitions, vais- seaux, bâtiments ou appareils de navigation aérienne appartenant au Sénégal ou affectés à sa défense;",TITRE DEUXIEME - CRIMES ET DELITS CONTRE LES PARTICULIERS,CHAPITRE PREMIER - CRIMES ET DELITS CONTRE LES PERSONNES,SECTION V - ATTENTATS AUX MOEURS,Paragraphe Il - Menaces,"(Loi n°99-05 du 29 janvier 1999)
Dans les cas prévus aux articles 319, 320, 310-1, 320-2 et 321, il ne pourra être prononcé le sursis à l'exécution de la peine.",Pénal
442,65-60,,323,,1965-07-21,PARTIE I - DISPOSITIONS PRELIMINAIRES,"Livrera à une puissance étrangère ou à ses agents, soit des troupes séné- galaises, soit des territoires, villes, forteresses, ouvrages, postes, magasins, arsenaux, matériels, munitions, vais- seaux, bâtiments ou appareils de navigation aérienne appartenant au Sénégal ou affectés à sa défense;",TITRE DEUXIEME - CRIMES ET DELITS CONTRE LES PARTICULIERS,CHAPITRE PREMIER - CRIMES ET DELITS CONTRE LES PERSONNES,SECTION V - ATTENTATS AUX MOEURS,Paragraphe Il - Menaces,"Sera considéré comme proxénète et puni d'un emprisonnement d'un an à trois ans et d'une amende de
250.000 à 2.500.000 francs,
sans préjudice de peines plus fortes s'il y échet, celui ou celle:
Qui, d'une manière quelconque, aide, assiste ou protège sciemment la prostitution d'autrui ou le racolage en vue de la prostitution;
Qui, sous une forme quelconque, partage les produits de la prostitution d'autrui ou reçoit des subsides d'une personne se livrant habituellement à la prostitution;
Qui, sciemment, vit avec une personne se livrant habituellement à la prostitution;
Qui, étant en relations habituelles avec une ou plusieurs personnes se livrant à la prostitution, ne peut justifier de ressources correspondant à son train de vie;
Qui	embauche, entraîne ou entretient, même avec son consentement, une personne même majeure en vue de la prostitution ou la livre à la prostitution ou à la débauche;
Qui fait office d'intermédiaire, à un titre quelconque, entre les personnes se livrant à la prostitution ou à la débauche et les individus qui exploitent ou rémunèrent la prostitution ou la débauche d'autrui;
Qui, par menace, pression, manœuvre ou par tout autre moyen, entrave l'action de prévention, de contrôle, d'assistance ou de rééducation entreprise par les organismes qualifiés en faveur de personnes se livrant à la prostitution ou en danger de prostitution.",Pénal
443,65-60,,324,,1965-07-21,PARTIE I - DISPOSITIONS PRELIMINAIRES,"Livrera à une puissance étrangère ou à ses agents, soit des troupes séné- galaises, soit des territoires, villes, forteresses, ouvrages, postes, magasins, arsenaux, matériels, munitions, vais- seaux, bâtiments ou appareils de navigation aérienne appartenant au Sénégal ou affectés à sa défense;",TITRE DEUXIEME - CRIMES ET DELITS CONTRE LES PARTICULIERS,CHAPITRE PREMIER - CRIMES ET DELITS CONTRE LES PERSONNES,SECTION V - ATTENTATS AUX MOEURS,Paragraphe Il - Menaces,"La peine sera d'un emprisonnement de deux à cinq ans et d'une amende de
300.000  à  4.000.000  de francs dans le cas où:
Le délit a été commis à l'égard d'un mineur;
Le délit a été accompagné de menace, de contrainte, de violence, de voie de fait, d'abus d'autorité ou de dol;
L'auteur du délit était porteur d'une arme apparente ou cachée;
L'auteur du délit est époux, père, mère ou tuteur de la victime ou appartient à l'une des catégories énumérées à l'article 321;
L'auteur du délit est appelé à participer, de par ses fonctions, à la lutte contre la prostitution, à la protection de la santé ou au maintien de l'ordre public;
Le délit a été commis à l'égard de plusieurs personnes;
Les victimes du délit ont été livrées ou incitées à se livrer à la prostitution hors du territoire national;
Les victimes du délit ont été livrées ou incitées à se livrer à la prostitution à leur arrivée ou dans un délai rapproché de leur arrivée sur le territoire national;
Le délit a été commis par plusieurs auteurs, co-auteurs ou complices;
Sera puni aux peines prévues au présent article, quiconque aura attenté aux mœurs en excitant, favorisant ou facilitant habituellement la débauche ou la corruption de la jeunesse de l'un ou l'autre sexe au-dessous de l'âge de vingt et un ans, ou, même occasionnellement,	des mineurs de seize ans.
Les peines prévues à l'article 323 et au présent article seront prononcées, alors même que les divers actes qui sont les éléments constitutifs des infractions auraient été accomplis dans des pays différents.",Pénal
444,65-60,,325,,1965-07-21,PARTIE I - DISPOSITIONS PRELIMINAIRES,"Livrera à une puissance étrangère ou à ses agents, soit des troupes séné- galaises, soit des territoires, villes, forteresses, ouvrages, postes, magasins, arsenaux, matériels, munitions, vais- seaux, bâtiments ou appareils de navigation aérienne appartenant au Sénégal ou affectés à sa défense;",TITRE DEUXIEME - CRIMES ET DELITS CONTRE LES PARTICULIERS,CHAPITRE PREMIER - CRIMES ET DELITS CONTRE LES PERSONNES,SECTION V - ATTENTATS AUX MOEURS,Paragraphe Il - Menaces,"Sera puni des peines prévues à l'article précédent tout individu:
Qui détient, direc-tement ou par personnes interposées, qui gère, dirige, fait fonctionner, finance ou contribue à financer un établissement de prostitution;
Qui, détenant, gérant, faisant fonctionner, finançant, contribuant à financer un hôtel, maison meublée, pension, débit de boissons, restaurant, club, cercle, dancing, lieu de spectacle ou leurs annexes ou lieu quelconque ouvert au public ou utilisé par le public, accepté	ou	tolère habituellement qu'une ou plusieurs personnes se livrent à la prostitution à l'intérieur de l'établissement ou dans ses annexes ou y recherchent des clients en vue de la prostitution;
Qui assiste les individus visés au 1 0 et 20;
En cas de nouvelle infraction dans un délai de dix ans, les peines encourues seront portées au double.",Pénal
445,65-60,,326,,1965-07-21,PARTIE I - DISPOSITIONS PRELIMINAIRES,"Livrera à une puissance étrangère ou à ses agents, soit des troupes séné- galaises, soit des territoires, villes, forteresses, ouvrages, postes, magasins, arsenaux, matériels, munitions, vais- seaux, bâtiments ou appareils de navigation aérienne appartenant au Sénégal ou affectés à sa défense;",TITRE DEUXIEME - CRIMES ET DELITS CONTRE LES PARTICULIERS,CHAPITRE PREMIER - CRIMES ET DELITS CONTRE LES PERSONNES,SECTION V - ATTENTATS AUX MOEURS,Paragraphe Il - Menaces,"Dans tous les cas où les faits incriminés se seront produits	dans	un établissement visé au 1 0 et au 20 de l'article 325 et dont le détenteur, le gérant ou le préposé est condamné par application des articles 324 ou 325, le jugement portera retrait de la licence dont le condamné serait bénéficiaire et prononcera en outre la fermeture de l'établissement ou des parties de l'établissement utilisées en vue de la prostitution pour une durée qui ne pourra être inférieure à trois mois ni supérieure à cinq ans.
Dans tous les cas, l'arrêt ou le jugement pourra en outre mettre les coupables en état d'interdiction de séjour et prononcer le retrait du passeport ainsi que, pour une durée de trois ans ou plus, la suspension du permis de conduire. Cette durée pourra être doublée en cas de récidive. Les mobiliers ayant servi directement ou indirectement à commettre l'infraction seront saisis et confisqués, à quelque personne qu'ils appartiennent.
Les auteurs d'infractions prévus aux articles 323, 324 ou 325 pourront être condamnés à rembourser les frais	éventuels	de rapatriement de ceux ou de celles dont ils ont exploité ou tenté d'exploiter ou contribué à  exploiter  la  prostitution.
Lorsque ces frais auront été avancés par l'administration, ils seront recouvrés comme frais de justice.",Pénal
